{
  "schemaVersion": 1,
  "pack": {
    "id": "dev.qdstudy.synthetic-demo",
    "title": "量化开发合成示例",
    "description": "用于体验平台交互的原创合成题目，不包含源 PDF 内容。",
    "version": "1.0.0",
    "locale": "zh-CN",
    "questionCount": 3,
    "createdAt": "2026-09-04T00:00:00Z",
    "license": {
      "scope": "private-personal-use",
      "redistribution": false,
      "notice": "合成演示数据，仅用于体验平台功能。"
    },
    "source": {
      "title": "QD Study 合成示例",
      "documentVersion": "demo-1"
    }
  },
  "chapters": [
    {
      "id": "1",
      "title": "低延迟系统思维",
      "order": 1,
      "sections": [
        { "id": "1.1", "title": "测量与权衡", "order": 1 }
      ]
    }
  ],
  "questions": [
    {
      "id": "1.1.1",
      "chapterId": "1",
      "sectionId": "1.1",
      "order": 1,
      "sourcePages": [1, 1],
      "original": {
        "prompt": "为什么在优化低延迟路径前必须先定义延迟分位数？",
        "interpretation": "考察平均延迟与尾延迟的区别，以及指标对优化方向的影响。",
        "knowledge": "- 延迟分布\n- P50/P99/P99.9\n- 测量扰动",
        "answer": "平均值会掩盖少量但严重的抖动。应同时报告吞吐量、典型分位数和最大值，并明确预热、采样窗口与硬件环境。",
        "extension": "进一步讨论时钟源、核绑定和观测工具自身的开销。"
      },
      "revision": {
        "quickAnswer": "因为交易系统通常被尾部事件击穿；分位数能区分典型性能和极端抖动。",
        "pitfalls": "只给平均值，或比较两组没有相同硬件、负载和预热条件的数据。",
        "followUps": ["如何选择 P99 与 P99.9？", "测量线程是否应该与业务线程同核？"]
      },
      "review": { "status": "verified", "notes": ["原创合成题目。"] }
    },
    {
      "id": "1.1.2",
      "chapterId": "1",
      "sectionId": "1.1",
      "order": 2,
      "sourcePages": [1, 1],
      "original": {
        "prompt": "一个结构体刚好等于 64 字节，是否意味着它一定不会产生伪共享？",
        "interpretation": "考察对象大小、对象起始地址对齐与数组布局的关系。",
        "knowledge": "缓存行、`alignas`、分配器对齐保证。",
        "answer": "不一定。大小为 64 字节不保证对象起始地址按 64 字节对齐；相邻对象也可能跨越缓存行。需要同时控制对齐和布局，并通过硬件计数器验证。",
        "extension": "比较 `alignas(64)` 与 `std::hardware_destructive_interference_size` 的语义。"
      },
      "revision": {
        "quickAnswer": "不一定；对象大小和对象地址对齐是两个独立条件。",
        "followUps": ["过度填充会带来什么代价？"]
      },
      "review": { "status": "reviewed" }
    },
    {
      "id": "1.1.3",
      "chapterId": "1",
      "sectionId": "1.1",
      "order": 3,
      "sourcePages": [1, 1],
      "original": {
        "prompt": "什么时候自旋等待比阻塞等待更合适？",
        "interpretation": "考察等待时长、CPU 预算、调度延迟和拓扑因素。",
        "knowledge": "自旋锁、上下文切换、超线程、退避。",
        "answer": "当临界区极短、竞争可控、线程有专用 CPU 且调度抖动比额外算力更昂贵时，自旋可能更合适。等待不可预测或 CPU 紧张时应阻塞或采用混合策略。",
        "extension": "说明指数退避、pause 指令和超线程资源竞争。"
      },
      "review": { "status": "raw" }
    }
  ]
}
